{"beliefs":[{"confidence":0.91,"evidence_ids":["evidence-0001"],"key":"red_cup_visible","timestamp":1000000,"value":false}],"captured_at_step":42,"continuation":{"active_skill":"place","active_stage":"transport","captured_at_step":42,"controller_state_ref":"controller-state-0042","held_object_hypothesis":null,"program_counter":2,"resumable_suffix":["place"]},"progress":[{"affected_by_event_ids":[],"arguments":["red_cup","basket"],"currently_preserved":true,"evidence_ids":["evidence-0001"],"milestone_id":"milestone:cup-placed","predicate":"inside","satisfaction":"satisfied","schema_version":"cope-exp1-trace-contract/v1","verified_at_step":42,"verifier_record_id":"verify-0001"}],"schema_version":"cope-exp1-trace-contract/v1"}
